Timestamp,Scenario,Morale,Stress,Pressure,Suggested Action
2025-07-19 15:22:59.345968,"The team has been working overtime for two weeks to meet a product launch deadline. Morale is dropping, and two team members have expressed burnout. A key client expects delivery in 5 days.",4,High,Yes,"⚠️ Error getting response: 

You tried to access openai.ChatCompletion, but this is no longer supported in openai>=1.0.0 - see the README at https://github.com/openai/openai-python for the API.

You can run `openai migrate` to automatically upgrade your codebase to use the 1.0.0 interface. 

Alternatively, you can pin your installation to the old version, e.g. `pip install openai==0.28`

A detailed migration guide is available here: https://github.com/openai/openai-python/discussions/742
"
2025-07-19 15:39:46.237890,"The team has been working overtime for two weeks to meet a product launch deadline. Morale is dropping, and two team members have expressed burnout. A key client expects delivery in 5 days.",4,High,Yes,"One practical and empathetic leadership action could be to prioritize the well-being of the team members by openly acknowledging the burnout and stress levels within the team. It is important to have a transparent conversation with the team about the current situation and the impact it is having on their mental and physical health.

Encourage the team members to openly communicate their concerns and feelings, and offer support in any way possible. This could include allowing flexible working hours, providing mental health resources, or even considering adjusting the deadline with the client if necessary.

By demonstrating empathy and understanding towards the team members' well-being, it not only shows that their health is a priority, but also helps to build trust and strengthen the team dynamics. This approach can ultimately lead to improved morale, productivity, and creativity in the long run."
2025-07-20 21:10:09.266587,Product is behind schedule,5,Medium,Yes,"A practical and empathetic leadership action in this situation would be to schedule a team meeting to address the current status of the project. During this meeting, it is important to openly communicate with the team about the challenges they are facing, provide support, and actively listen to their concerns.

By acknowledging the team's hard work and dedication, leaders can help boost team morale and show appreciation for their efforts. Additionally, discussing potential solutions and adjusting deadlines or resources if necessary can help alleviate some of the stress and pressure the team is feeling.

Showing empathy towards the team members' feelings and concerns can help build trust and foster a positive working environment. It is important for leaders to be understanding and supportive during difficult times to maintain team motivation and productivity. Taking proactive steps to address issues and provide support demonstrates effective leadership and helps ensure the success of the project in the long run."
2025-07-20 21:10:39.275894,Product is behind schedule,5,Low,Yes,"A practical and empathetic leadership action in this situation would be to hold a team meeting to address the issue openly and transparently. During this meeting, it is important to acknowledge the team's hard work and dedication, while also expressing understanding and empathy for the challenges they may be facing.

By discussing the reasons behind the delay in the product schedule and listening to any concerns or suggestions from team members, you can create a sense of ownership and collaboration within the team. This can help boost morale and motivate team members to work together towards finding solutions to meet the deadline.

Additionally, providing support and resources to help alleviate any stress or workload pressure can also show empathy towards the team. This could involve reevaluating timelines, allocating additional resources, or offering assistance with any roadblocks that team members may be facing.

Overall, taking the time to communicate openly, listen actively, and show empathy towards the team's concerns can help create a positive and supportive work environment, ultimately helping to improve team morale and productivity in the face of deadline pressure."
2025-07-20 21:11:22.618862,product is on schedule,5,Low,No,"Practical, empathetic leadership action: Schedule a team morale boosting activity such as a team lunch or virtual team building exercise.

Explanation: Even though the project is on schedule and there is low stress and no deadline pressure, it is crucial to address the team morale aspect. A team with low morale may not perform at their best and could lead to potential issues down the line. By organizing a morale boosting activity, you show your team that you care about their well-being and that you value their hard work. This can help improve team dynamics, boost motivation, and create a positive working environment. Investing in your team's morale now can also prevent any future potential burnout or disengagement issues."
2025-07-20 21:14:54.837237,product is on schedule,5,Low,Yes,"Practical, empathetic leadership action: Organize a team bonding activity to boost morale.

Explanation: While the team may be on schedule and experiencing low stress levels, a morale rating of 5/10 indicates that there may be some underlying issues affecting team cohesion and motivation. By organizing a team bonding activity, you are showing empathy towards your team members by acknowledging their efforts and providing them with an opportunity to relax and connect with each other outside of work tasks. This can help improve team dynamics, boost morale, and ultimately lead to a more positive and productive work environment. Additionally, team bonding activities can help alleviate any potential tension or conflicts that may arise due to deadline pressure, fostering a sense of unity and collaboration among team members. It is important for leaders to prioritize team well-being and morale, even in times when the project is on schedule, as a strong team dynamic is crucial for long-term success and performance."
